{
  "schema_version": 1,
  "brief_id": "slide-creator-demo-auto",
  "mode": "auto",
  "language": "zh-CN",
  "title": "Slide Creator",
  "audience": "正在评估 slide-creator 的产品经理和开发者",
  "desired_action": "用真实内容试跑第一套 deck",
  "deck": {
    "deck_type": "user-content",
    "page_count": 8,
    "output_format": "html-slides"
  },
  "style": {
    "preset": "Blue Sky",
    "tone": "清爽、可信、偏产品介绍",
    "visual_density": "medium"
  },
  "content": {
    "source_policy": "distill-only",
    "must_include": [
      "slide-creator 是什么",
      "从 prompt 到 deck 的轻量工作流",
      "浏览器原生输出与可编辑性"
    ],
    "must_avoid": [
      "泛泛开场",
      "连续重复布局",
      "与 thesis 无关的背景信息"
    ],
    "global_facts": [
      "BRIEF.json 是 source of truth",
      "风格必须锁到选中的 preset",
      "输出必须先过 strict validate"
    ],
    "optional_support": [
      "支持 present mode 与 edit mode",
      "默认保留水印注入",
      "HTML 输出可继续导出 PPTX 或 PNG"
    ]
  },
  "narrative": {
    "thesis": "slide-creator 把内容提炼、风格锁定和 HTML 交付压缩成一个可重复的轻量工作流。",
    "page_roles": [
      "cover",
      "problem",
      "solution",
      "workflow",
      "style-discovery",
      "output-contract",
      "best-fit",
      "closing"
    ],
    "slides": [
      {
        "slide_number": 1,
        "role": "cover",
        "title": "Slide Creator",
        "title_emphasis": "Creator",
        "key_point": "从 prompt 到可演示 HTML deck",
        "visual": "hero statement",
        "claim": "Slide Creator 把内容提炼和 HTML deck 交付压成一个轻量流程",
        "explanation": "从 prompt 到可演示 HTML deck，先锁 BRIEF，再锁风格和结构",
        "visual_intent": "hero statement with one focal stat",
        "preferred_layout_family": "hero"
      },
      {
        "slide_number": 2,
        "role": "problem",
        "title": "好内容经常被糟糕的演示稿拖累",
        "key_point": "模板老旧、排版不稳、改一版成本高",
        "visual": "comparison cards",
        "claim": "演示稿返工成本高，往往不是内容问题，而是结构和风格决策不稳定",
        "explanation": "模板老旧、排版不稳、改一版成本高，导致内容反而成了次要成本",
        "visual_intent": "split evidence comparison",
        "preferred_layout_family": "comparison",
        "supporting_facts": [
          "结构不稳会放大返工",
          "排版返工比内容返工更隐性",
          "人工微调通常发生在后期"
        ]
      },
      {
        "slide_number": 3,
        "role": "solution",
        "title": "slide-creator 让 deck 生成更稳定",
        "key_point": "把规划、风格和交付压到一个工作流里",
        "visual": "three-step flow",
        "claim": "稳定性来自先提炼 IR，再执行 deterministic render",
        "explanation": "把规划、风格和交付压到一个工作流里，减少 late-context 漂移",
        "visual_intent": "process flow with three steps",
        "preferred_layout_family": "flow",
        "supporting_facts": [
          "plan 先提炼 BRIEF",
          "generate 再读取单 preset contract",
          "写入前必须 strict validate"
        ]
      },
      {
        "slide_number": 4,
        "role": "workflow",
        "title": "默认路径足够短",
        "key_point": "先提炼 BRIEF，再生成 HTML",
        "visual": "command timeline",
        "claim": "IR-first 让默认路径变短，同时保留精修空间",
        "explanation": "先提炼 BRIEF，再生成 HTML，需要时再补 review 与 polish",
        "visual_intent": "command timeline with short phases",
        "preferred_layout_family": "flow"
      },
      {
        "slide_number": 5,
        "role": "style-discovery",
        "title": "风格选择是 wow moment",
        "key_point": "先看 3 个预览，再锁定 preset",
        "visual": "preview trio",
        "claim": "先看方向再锁 preset，比先问卷式收集偏好更稳",
        "explanation": "先看 3 个预览，再锁定 preset，让用户用反应而不是抽象描述做选择",
        "visual_intent": "three preview cards",
        "preferred_layout_family": "evidence"
      },
      {
        "slide_number": 6,
        "role": "output-contract",
        "title": "输出不是一次性截图",
        "key_point": "浏览器原生运行、可播放、默认可编辑",
        "visual": "capability badges",
        "claim": "HTML 输出既是交付物，也是后续导出的中间真相源",
        "explanation": "浏览器原生运行、可播放、默认可编辑，还可以继续导出为 PPTX 或 PNG",
        "visual_intent": "capability badge stack",
        "preferred_layout_family": "evidence"
      },
      {
        "slide_number": 7,
        "role": "best-fit",
        "title": "适合需要高质量 deck 的日常场景",
        "key_point": "产品发布、内部汇报、技术分享都能复用",
        "visual": "use case cards",
        "claim": "一套稳定链路能覆盖高频日常分享，而不是只适合一次性 demo",
        "explanation": "产品发布、内部汇报、技术分享都能复用，减少反复从头做 deck 的成本",
        "visual_intent": "use case comparison cards",
        "preferred_layout_family": "comparison"
      },
      {
        "slide_number": 8,
        "role": "closing",
        "title": "先出一版，再精修",
        "key_point": "默认快，关键 deck 再锁质量",
        "visual": "closing CTA",
        "claim": "先把可运行的高质量初稿做出来，再把精力放在值得深修的关键 deck 上",
        "explanation": "默认快，关键 deck 再锁质量，这比一开始就把所有场景都做重更现实",
        "visual_intent": "authoritative close with one action stack",
        "preferred_layout_family": "close"
      }
    ]
  },
  "runtime": {
    "editing_mode": true,
    "presenter_mode": true,
    "watermark_mode": "injected-last-slide",
    "export_intent": "none"
  },
  "plan_view": {
    "emit_planning_view": false,
    "planning_view_path": "PLANNING.md"
  },
  "timing": {
    "estimate": {
      "plan": "1-2 min",
      "generate": "1-3 min",
      "validate": "<1 min",
      "polish": "0-2 min",
      "total": "3-6 min"
    },
    "actual": {
      "plan": "0m 00s",
      "generate": "0m 00s",
      "validate": "0m 00s",
      "polish": "0m 00s",
      "total": "0m 00s"
    }
  },
  "notes": ""
}
